{
  "id": "python",
  "nome": "Python",
  "sigla": "Py",
  "resumo": "Sintaxe limpa, muito usada em dados, automação e inteligência artificial.",
  "unidades": [
    {
      "id": "python-basico",
      "numero": 1,
      "titulo": "Fundamentos",
      "resumo": "Os primeiros passos em Python.",
      "nos": [
        {
          "tipo": "licao",
          "id": "python-saida",
          "titulo": "Primeiro programa",
          "resumo": "Mostre texto e contas na tela com print.",
          "explicacao": [
            {
              "titulo": "print",
              "texto": "print mostra na tela o que está entre os parênteses. Texto vai entre aspas; números e contas, não.",
              "codigo": "print(\"Olá, mundo!\")\nprint(2 + 3)"
            }
          ],
          "exercicios": [
            {
              "tipo": "escolha",
              "pergunta": "O que este código mostra na tela?",
              "codigo": "print(\"Oi\")",
              "opcoes": [
                "Oi",
                "print(\"Oi\")",
                "\"Oi\""
              ],
              "correta": 0,
              "explicacao": "As aspas marcam onde o texto começa e termina, mas não aparecem na tela.",
              "id": "e1"
            },
            {
              "tipo": "montar",
              "pergunta": "Monte o código que mostra Python na tela.",
              "pecas": [
                "print",
                "(",
                "\"Python\"",
                ")"
              ],
              "extras": [
                "echo",
                "{"
              ],
              "explicacao": "print, parênteses e o texto entre aspas.",
              "id": "e2"
            },
            {
              "tipo": "completar",
              "pergunta": "Complete para mostrar o número 7.",
              "antes": "",
              "depois": "(7)",
              "respostas": [
                "print"
              ],
              "explicacao": "print serve para texto e para números.",
              "id": "e3"
            },
            {
              "tipo": "escolha",
              "pergunta": "Qual linha tem erro?",
              "opcoes": [
                "print(\"Oi\")",
                "print(\"Oi)",
                "print(7)"
              ],
              "correta": 1,
              "explicacao": "As aspas abrem e não fecham.",
              "id": "e4"
            },
            {
              "tipo": "montar",
              "pergunta": "Mostre o resultado de 10 menos 4.",
              "pecas": [
                "print",
                "(",
                "10",
                "-",
                "4",
                ")"
              ],
              "extras": [
                "+",
                "\"10\""
              ],
              "explicacao": "Sem aspas, o Python faz a conta e mostra 6.",
              "id": "e5"
            }
          ]
        },
        {
          "tipo": "licao",
          "id": "python-variaveis",
          "titulo": "Variáveis",
          "resumo": "Guarde valores com um nome para usar depois.",
          "explicacao": [
            {
              "titulo": "Guardar um valor",
              "texto": "Uma variável é um nome para um valor. O sinal = guarda o valor da direita no nome da esquerda; não é comparação.",
              "codigo": "idade = 18\nnome = \"Ana\"\nprint(nome)"
            }
          ],
          "exercicios": [
            {
              "tipo": "escolha",
              "pergunta": "O que aparece na tela?",
              "codigo": "x = 5\nx = x + 2\nprint(x)",
              "opcoes": [
                "5",
                "7",
                "x + 2"
              ],
              "correta": 1,
              "explicacao": "x começa em 5 e passa a valer 5 + 2.",
              "id": "e1"
            },
            {
              "tipo": "montar",
              "pergunta": "Guarde 10 na variável pontos.",
              "pecas": [
                "pontos",
                "=",
                "10"
              ],
              "extras": [
                "==",
                "let"
              ],
              "explicacao": "Nome, sinal de igual e valor. Python não usa let nem ponto e vírgula.",
              "id": "e2"
            },
            {
              "tipo": "completar",
              "pergunta": "Complete para guardar o texto Ana em nome.",
              "antes": "nome = ",
              "depois": "",
              "respostas": [
                "\"Ana\""
              ],
              "explicacao": "Texto precisa de aspas. Sem elas, o Python procuraria uma variável chamada Ana.",
              "id": "e3"
            },
            {
              "tipo": "escolha",
              "pergunta": "Qual é o tipo do valor 3.5?",
              "opcoes": [
                "int (inteiro)",
                "float (número com casas decimais)",
                "str (texto)"
              ],
              "correta": 1,
              "explicacao": "Número com ponto decimal é float.",
              "id": "e4"
            },
            {
              "tipo": "escolha",
              "pergunta": "Qual nome de variável é válido?",
              "opcoes": [
                "2nome",
                "meu nome",
                "meu_nome"
              ],
              "correta": 2,
              "explicacao": "Nome não começa com número nem tem espaço. O sublinhado separa as palavras.",
              "id": "e5"
            }
          ]
        },
        {
          "tipo": "licao",
          "id": "python-condicoes",
          "titulo": "Condições",
          "resumo": "Faça o programa decidir com if e else.",
          "explicacao": [
            {
              "titulo": "if e else",
              "texto": "O if executa um bloco só quando a condição é verdadeira. A linha termina com dois-pontos e o bloco fica recuado.",
              "codigo": "if idade >= 18:\n    print(\"Maior\")\nelse:\n    print(\"Menor\")"
            }
          ],
          "exercicios": [
            {
              "tipo": "escolha",
              "pergunta": "O que aparece na tela?",
              "codigo": "nota = 6\nif nota >= 7:\n    print(\"Aprovado\")\nelse:\n    print(\"Recuperação\")",
              "opcoes": [
                "Aprovado",
                "Recuperação",
                "Nada"
              ],
              "correta": 1,
              "explicacao": "Como 6 não é maior ou igual a 7, roda o bloco do else.",
              "id": "e1"
            },
            {
              "tipo": "montar",
              "pergunta": "Monte a condição: se x for maior que 10.",
              "pecas": [
                "if",
                "x",
                ">",
                "10",
                ":"
              ],
              "extras": [
                "then",
                "<"
              ],
              "explicacao": "Em Python não há parênteses obrigatórios nem then: a linha termina com dois-pontos.",
              "id": "e2"
            },
            {
              "tipo": "completar",
              "pergunta": "Complete com o operador que compara se dois valores são iguais.",
              "antes": "if senha ",
              "depois": " \"1234\":",
              "respostas": [
                "=="
              ],
              "explicacao": "Dois sinais de igual comparam. Um só guarda valor.",
              "id": "e3"
            },
            {
              "tipo": "escolha",
              "pergunta": "O que vem no fim da linha do if?",
              "opcoes": [
                "Ponto e vírgula ;",
                "Dois-pontos :",
                "Chave {"
              ],
              "correta": 1,
              "explicacao": "Os dois-pontos avisam que um bloco começa na linha seguinte.",
              "id": "e4"
            },
            {
              "tipo": "escolha",
              "pergunta": "Como o Python sabe o que está dentro do if?",
              "opcoes": [
                "Pelas chaves { }",
                "Pelo recuo das linhas",
                "Pela palavra end"
              ],
              "correta": 1,
              "explicacao": "O recuo (indentação) é o que define o bloco. Linha sem recuo já está fora do if.",
              "id": "e5"
            }
          ]
        },
        {
          "tipo": "licao",
          "id": "python-lacos",
          "titulo": "Laços",
          "resumo": "Repita um bloco com for e while.",
          "explicacao": [
            {
              "titulo": "for e range",
              "texto": "O for repete um bloco para cada valor. range(3) gera 0, 1 e 2: começa em zero e para antes do número informado.",
              "codigo": "for i in range(3):\n    print(i)"
            }
          ],
          "exercicios": [
            {
              "tipo": "escolha",
              "pergunta": "Quantas vezes Oi aparece?",
              "codigo": "for i in range(4):\n    print(\"Oi\")",
              "opcoes": [
                "3",
                "4",
                "5"
              ],
              "correta": 1,
              "explicacao": "range(4) gera quatro valores: 0, 1, 2 e 3.",
              "id": "e1"
            },
            {
              "tipo": "escolha",
              "pergunta": "Quais números aparecem?",
              "codigo": "for i in range(3):\n    print(i)",
              "opcoes": [
                "1, 2, 3",
                "0, 1, 2",
                "0, 1, 2, 3"
              ],
              "correta": 1,
              "explicacao": "range começa em 0 e para antes do 3.",
              "id": "e2"
            },
            {
              "tipo": "montar",
              "pergunta": "Monte o laço que repete 5 vezes.",
              "pecas": [
                "for",
                "i",
                "in",
                "range",
                "(",
                "5",
                ")",
                ":"
              ],
              "extras": [